ContContracts Register -  All live contracts ,,,,,,,,,,,,,,,,,,,,,,,,,,
Ref No,Contract Title,Directorate,Department,Team Name,Classification,Term Contract,OJEU,Awarded,Has ext option,Contract variation,Electronics watch,Serivce type,Budget,Actual cost,Est cost,Cost variance,Duration (months),Extended,Ext post contract,Auth to tender,Framework Agreement,Initial start date,Initial end date,Ext start date,Ext end date,Successful supplier
7040,Operational Contingency Arrangements,Directorate for Preparedness and Response,Operational Resilience and Control,Operational Planning and Collaboration,Professional Services  / Operational Services,Yes,Yes,Yes,No,,,Goods/Service,Expenditure,"£ 30,000,000","£ 30,000,000",£ 0,72,No,No,,,01/11/2023,31/10/2029,,, SECURITAS SECURITY ) SERVICES (UK) LIMITED (vendor no: N/A)
7243,7019,Directorate for Preparedness and Response,Operational Resilience and Control,Response and Training,Professional Services  / Development and Training,Yes,No,Yes,No,,,Goods/Service,Expenditure,"£ 45,000","£ 45,000",£ 0,12,No,No,,,25/10/2023,24/10/2024,,, NORTHAMPTONSHIRE COUNTY (vendor no: 20890)
7142,Travel Management ,Directorate of Corporate Services,Procurement and Commercial,Categories & Performance,Professional Services  / Travel Management,Yes,No,Yes,No,,,Goods/Service,Expenditure,"£ 280,000","£ 280,000",£ 0,48,No,No,,,19/07/2023,18/07/2027,,, CTM  (vendor no: N/A)
6799,Provision of occupational health service,People Directorate,People Services,"Wellbeing, Health & Fitness   ",Professional Services  / HR Services,Yes,Yes,Yes,No,,,Goods/Service,Expenditure,"£ 7,500,000","£ 7,500,000",£ 0,60,No,No,,,30/06/2023,29/06/2028,,, Health Management Ltd (vendor no: N/A)
7212,Website Development ,Commissioner,Communications,Internal Communications,ICT / Services,Yes,No,Yes,No,,,Goods/Service,Expenditure,"£ 145,000","£ 145,000",£ 0,12,No,No,,G-Cloud 13,11/06/2023,10/06/2024,,, E3 Media Ltd t/a Great State (vendor no: 20896)
7218,Mental Health First Aid,Commissioner,People Directorate,Health & Safety,Professional Services  / Staff Health and Safety,Yes,No,Yes,No,,,Goods/Service,Expenditure,"£ 42,000","£ 42,000",£ 0,12,No,No,,,06/06/2023,05/06/2024,,, Premier First Aid  (vendor no: N/A)
7183,Website Maintenance  ,Commissioner,Communications,Internal Communications,ICT / Services,Yes,No,Yes,No,,,Goods/Service,Expenditure,"£ 120,000","£ 120,000",£ 0,12,No,No,,G-Cloud 13,04/06/2023,03/06/2024,,, E3 Media Ltd t/a Great State (vendor no: 20896)
6764,Senior Interim Appointment ,People Directorate,People Services,Leavers,Professional Services  / Contingent Labour,No,No,Yes,No,,,Goods/Service,Expenditure,"£ 130,000","£ 130,000",£ 0,6,No,No,,,01/06/2023,03/06/2024,,, Gatenby Sanderson (vendor no: 21038)
6795,Applied Health and Safety (Level 3 Certificate),People Directorate,Training and Professional Development,Health & Safety,Professional Services  / Development and Training,Yes,No,Yes,No,,,Goods/Service,Expenditure,"£ 27,000","£ 27,000",£ 0,48,No,No,,,26/05/2023,25/05/2027,,, Premier First Aid (vendor no: N/A)
7169,SFE Training ,Directorate for Preparedness and Response,Operational Resilience and Control,Executive Business and Governance Team,Professional Services  / Development and Training,Yes,No,Yes,No,,,Goods/Service,Income,"£ 350,000","£ 350,000",£ 0,36,No,No,,,26/05/2023,25/05/2026,,, Fire Safety College  (vendor no: N/A)
7219,Carbon Net Zero Design - Five Stations,Directorate of Corporate Services,Property and TSS,Property Major Projects,Construction and FM / Consultancy,No,No,Yes,No,,,Goods/Service,Expenditure,"£ 233,875","£ 230,000","£ 3,875",12,No,No,,,24/05/2023,23/05/2024,,, E.ON Energy Installation Services Limited (vendor no: N/A)
7238,HAYS recruitment ,Directorate of Corporate Services,Property and TSS,Property Strategy,Professional Services  / Contingent Labour,No,No,Yes,No,,,Goods/Service,Expenditure,"£ 103,594","£ 103,594",£ 0,12,No,No,,3S-22 Lot 2b,19/05/2023,18/05/2024,,, HAYS SPECIALIST RECRUITMENT] (vendor no: 20575)
7147,Forest Hill & Park Royal Window Replacements,Commissioner,Directorate of Corporate Services,Property Major Projects,Construction and FM / Property Occupation,No,No,Yes,No,,,Works,Expenditure,"£ 280,882","£ 315,000","(£ 34,118)",16,No,No,,,15/05/2023,14/09/2024,,, Re-Gen (UK) Construction Ltd (vendor no: 22474)
7007,Fire Investigation Basic Practical Course,"Directorate for Prevention, Protection and Operational Policy",Prevention and Protection,FSR Learning,Professional Services  / Development and Training,Yes,No,Yes,No,,,Goods/Service,Expenditure,"£ 90,000","£ 90,000",£ 0,36,No,No,,,12/05/2023,11/05/2026,,, Part B (vendor no: N/A)
7217,Mental Health First Aid,People Directorate,People Services,"Wellbeing, Health & Fitness   ",Professional Services  / Development and Training,Yes,No,Yes,No,,,Goods/Service,Expenditure,"£ 42,000","£ 42,000",£ 0,12,No,No,,,01/05/2023,30/04/2024,,, Mental Health First Aid (MHFA) (vendor no: 21569)
6415,Replacement Fireground Radios,Directorate of Corporate Services,Information and Communications Technology ,Emergency Services Network,ICT / Communication,Yes,No,Yes,No,,,Goods/Service,Expenditure,"£ 1,600,000","£ 1,600,000",£ 0,84,No,No,,CCS Network Services 2 - RM3808 - Lot 11,01/05/2023,30/04/2030,,, Radiocoms Systems Limited (vendor no: 10961)
7118,Display Screen Equipment training and risk assessment software,People Directorate,Health and Safety,Health & Safety,ICT / Software,Yes,No,Yes,No,,,Goods/Service,Expenditure,"£ 19,852","£ 19,900",(£ 48),24,No,No,Head of Procurement approval for single tender action,,30/04/2023,29/04/2025,,, Cardinus Risk Management Limited (vendor no: N/A)
7156, 6983   Property & TSS Department Training  ,Directorate of Corporate Services,Property and TSS,Property Strategy,Professional Services  / Development and Training,No,No,Yes,No,,,Goods/Service,Expenditure,"£ 14,600","£ 14,600",£ 0,4,No,No,,,21/04/2023,31/07/2023,,, Institute of Workplace & Facilities Management (IWFM) (vendor no: 22078)
7220,Multi-Agency Gold Incident Command (MAGIC) 2023-24 ,Directorate for Preparedness and Response,Operational Resilience and Control,London Resilience Group,Professional Services  / Development and Training,Yes,No,Yes,No,,,Goods/Service,Expenditure,"£ 104,628","£ 104,628",£ 0,12,No,No,,,18/04/2023,16/11/2023,,, COLLEGE OF POLICING (vendor no: 18171)
7076,CPD For Fire Safety ,"Directorate for Prevention, Protection and Operational Policy",Prevention and Protection,FSR Learning,Professional Services  / Development and Training,Yes,No,Yes,No,,,Goods/Service,Expenditure,"£ 50,000","£ 50,000",£ 0,36,No,No,,,04/04/2023,03/04/2026,,, Part B (vendor no: N/A)
6967,Fire Investigation Basic Theory ,"Directorate for Prevention, Protection and Operational Policy",Prevention and Protection,FSR Learning,Professional Services  / Development and Training,Yes,No,Yes,No,,,Goods/Service,Expenditure,"£ 72,000","£ 72,000",£ 0,24,No,No,,,04/04/2023,03/04/2025,,, Bureau Veritas (vendor no: N/A)
6754,Fire Safety Qualification (Interim Contract),"Directorate for Prevention, Protection and Operational Policy",Prevention and Protection,FSR Learning,Professional Services  / Development and Training,Yes,No,Yes,No,,,Goods/Service,Expenditure,"£ 128,000","£ 128,000",£ 0,12,No,No,,,04/04/2023,03/04/2024,,, Xact (vendor no: N/A)
7067,Pay and Allowances Review,People Directorate,People Services,Organisational Effectiveness,Professional Services  / Consultancy,No,No,Yes,No,,,Goods/Service,Expenditure,"£ 80,000","£ 80,000",£ 0,12,No,No,,,04/04/2023,,,,
7236,The Introduction of the Head of Procurement,Directorate of Corporate Services,Procurement and Commercial,Categories & Performance,Professional Services  / HR Services,No,No,Yes,No,,,Goods/Service,Expenditure,"£ 100,000","£ 100,000",£ 0,12,No,No,,,04/04/2023,03/04/2024,,, Heads Resourcing Group Ltd (vendor no: 22494)
7184,Farynor Spport,Directorate of Corporate Services,Information and Communications Technology ,ICT Management,ICT / Services,No,No,Yes,No,,,Goods/Service,Expenditure,"£ 124,575","£ 130,000","(£ 5,425)",12,No,No,,G-Cloud 13,01/04/2023,31/03/2024,,, Atkins Global (vendor no: N/A)
7211,E-Recruitment System,People Directorate,People Services,Recruitment & Resourcing,ICT / Services,No,No,Yes,No,,,Goods/Service,Expenditure,"£ 77,200","£ 82,000","(£ 4,800)",12,No,No,,G-Cloud 13,24/03/2023,23/03/2024,,, Lumesse (vendor no: 20992)
6964,Fuel Cards and Associated Services ,Directorate for Preparedness and Response,Fire Stations,Fire Stations & Area Team Management,Fleet  / Fuel,Yes,No,Yes,No,,,Goods/Service,Expenditure,"£ 2,000,000","£ 2,000,000",£ 0,12,No,No,,YPO,23/03/2023,22/03/2027,,, All Star Business Solutions (vendor no: 4888)
7193,Safety Climate Tool,People Directorate,Health and Safety,Health & Safety,Professional Services  / Development and Training,Yes,No,Yes,No,,,Goods/Service,Expenditure,"£ 45,100","£ 45,100",£ 0,24,No,No,,,23/03/2023,22/03/2025,,, The Stationary Office (vendor no: N/A)
6862,North Kensington Fire Station Provision of Motorised Yard Gates,Directorate of Corporate Services,Property and TSS,Property Major Projects,Construction and FM / Industrial Goods,No,No,Yes,No,,,Works,Expenditure,"£ 74,000","£ 120,000","(£ 46,000)",3,No,No,Delegated Authority,,06/03/2023,05/06/2023,,, securafit (vendor no: N/A)
7005,"Stanmore fire station, Privacy for All works  ",Directorate of Corporate Services,Property and TSS,Property Access & Workplace,Construction and FM / Property Occupation,No,No,Yes,No,,,Works,Expenditure,"£ 100,255","£ 100,255",£ 0,3,No,No,Standing Order,,06/03/2023,05/06/2023,,, B. Nokes (vendor no: 19094)
7213,Cyborg Maintenance Services Agreement,Directorate of Corporate Services,Information and Communications Technology ,ICT Management,ICT / Services,No,No,Yes,No,,,Goods/Service,Expenditure,"£ 105,062","£ 106,000",(£ 938),12,No,No,,G-Cloud 13,01/03/2023,29/02/2024,,, SumTotal Systems UK Limited (vendor no: 13368)
7167,Institute of Leadership & Management (ILM) Level 7 Certificate for Executive & Senior Level Coaches & Mentors Programme ,People Directorate,People Services,Leadership Development,Professional Services  / Development and Training,No,No,Yes,No,,,Goods/Service,Expenditure,"£ 2,250","£ 2,250",£ 0,0,No,No,,,01/03/2023,31/05/2023,,," Advanced Coaching Academy  (vendor no: N/A), Advanced Coaching Academy  (vendor no: N/A)"
7176,Cisco DNA ,Directorate of Corporate Services,Information and Communications Technology ,Network,ICT / Software,No,No,Yes,No,,,Goods/Service,Expenditure,"£ 14,000","£ 11,000","£ 3,000",12,No,No,,,27/02/2023,26/02/2024,,, Intuitive Systems & Networks Ltd (ISN) (vendor no: N/A)
6860,Lewisham Fire Station Provision of Motorised Yard Gates,Directorate of Corporate Services,Property and TSS,Property Major Projects,Construction and FM / Industrial Goods,No,No,Yes,No,,,Works,Expenditure,"£ 110,000","£ 120,000","(£ 10,000)",2,No,No,Delegated Authority,,27/02/2023,26/04/2023,,, securafit (vendor no: N/A)
6864,Leyton Fire Station Provision of Motorised Yard Gates,Directorate of Corporate Services,Property and TSS,Property Major Projects,Construction and FM / Industrial Goods,No,No,Yes,No,,,Works,Expenditure,"£ 55,000","£ 120,000","(£ 65,000)",3,No,No,Delegated Authority,,27/02/2023,26/05/2023,,, securafit (vendor no: N/A)
6865,Tooting Fire Station Provision of Motorised Yard Gates,Directorate of Corporate Services,Property and TSS,Property Major Projects,Construction and FM / Industrial Goods,No,No,Yes,No,,,Works,Expenditure,"£ 79,000","£ 120,000","(£ 41,000)",2,No,No,Delegated Authority,,27/02/2023,26/04/2023,,, securafit (vendor no: N/A)
6923,"North Kensington fire station, Privacy for All works  ",Directorate of Corporate Services,Property and TSS,Property Access & Workplace,Construction and FM / Building Operations,No,No,Yes,No,,,Works,Expenditure,"£ 580,635","£ 500,000","£ 80,635",3,No,No,Committee Decision,,20/02/2023,,,, B Nokes Contracts (vendor no: 19094)
6995,"Harrow fire station, Privacy for All works to ground and first floor dorms and showers",Directorate of Corporate Services,Property and TSS,Property Access & Workplace,Construction and FM / Property Occupation,No,No,Yes,No,,,Works,Expenditure,"£ 196,178","£ 175,000","£ 21,178",3,No,No,Committee Decision,,08/02/2023,05/04/2023,,, Woodnut Construction and Developments Ltd (vendor no: 21961)
6906,ERITH BREATHING APPARATUS CHAMBER REFURBISHMENT,Directorate of Corporate Services,Property and TSS,Property Major Projects,Construction and FM / Building Operations,No,No,Yes,No,,,Goods/Service,Expenditure,"£ 449,342","£ 20,000","£ 429,342",18,No,No,Delegated Authority,MDC FRAMEWORK AGREEMENT,06/02/2023,05/08/2024,,, Collins Contractors Ltd (vendor no: 2155)
6849,Corporate Gazetteer Replacement,Directorate of Corporate Services,Information and Communications Technology ,Technical Projects,ICT / Software,Yes,Yes,Yes,No,,,Goods/Service,Expenditure,"£ 123,913","£ 90,000","£ 33,913",24,No,No,Budget Holder Approval,,01/02/2023,31/01/2025,,, Bramble Hub (vendor no: N/A)
7172,Finance System Maintenance ,Directorate of Corporate Services,Information and Communications Technology ,ICT Management,ICT / Services,Yes,No,Yes,Yes,,,Goods/Service,Expenditure,"£ 130,000","£ 130,000",£ 0,12,No,No,,G-Cloud 12,01/02/2023,31/01/2024,,, Infor Limited (vendor no: N/A)
7100,LED Energy efficient lighting project Sutton and Clapham,Directorate of Corporate Services,Property and TSS,Property Major Projects,Construction and FM / Engineering Products and Equipment,No,No,Yes,No,,,Works,Expenditure,"£ 95,883","£ 120,000","(£ 24,117)",1,No,No,Delegated Authority,LCP ,01/02/2023,28/02/2023,,, Lindfield Electrical  (vendor no: N/A)
7015,Library Management System ,Directorate of Corporate Services,Information and Communications Technology ,ICT Management,ICT / Software,Yes,No,Yes,Yes,,,Goods/Service,Expenditure,"£ 6,390","£ 40,000","(£ 33,610)",60,No,No,Budget Holder Approval,G-Cloud 12,01/02/2023,31/01/2025,,, PTFS Europe Ltd (vendor no: 20653)
7139,Kensington Windows Refurbishment,Commissioner,Directorate of Corporate Services,Property Major Projects,Construction and FM / Property Occupation,No,No,Yes,No,,,Works,Expenditure,"£ 287,633","£ 195,000","£ 92,633",16,No,No,,,30/01/2023,29/05/2024,,, Collins Contractors Ltd (vendor no: 2155)
7146,Whitechapel Appliance Bay Doors,Commissioner,Directorate of Corporate Services,Property Major Projects,Construction and FM / Building Operations,No,No,Yes,No,,,Works,Expenditure,"£ 77,001","£ 95,000","(£ 17,999)",4,No,No,,,30/01/2023,29/05/2023,,, ARKAS Ltd (vendor no: N/A)
6896,Mobile Communications,Directorate of Corporate Services,Information and Communications Technology ,ICT Management,ICT / Communication,Yes,No,Yes,No,,,Goods/Service,Expenditure,"£ 3,000,000","£ 3,000,000",£ 0,60,No,No,,CCS Network Services 2,27/01/2023,26/01/2025,,, Telefonica UK Ltd (vendor no: 22499)
7180,Engagement of Gatenby Sanderson,Commissioner,People Directorate,Employee Advice & Insights,Professional Services  / HR Services,Yes,No,Yes,No,,,Goods/Service,Expenditure,"£ 25,000","£ 25,000",£ 0,0,No,No,,,25/01/2023,24/01/2023,,, Gatenby Sanderson (vendor no: N/A)
7158,CRF Learning,People Directorate,People Services,"People Strat, Work Plan & Data",Professional Services  / Development and Training,Yes,No,Yes,No,,,Goods/Service,Expenditure,"£ 39,750","£ 39,750",£ 0,24,No,No,,,24/01/2023,23/01/2025,,, CRF (vendor no: 22043)
7162,External Complaints Service -CMP,People Directorate,People Services,"People Strat, Work Plan & Data",Professional Services  / HR Services,No,No,Yes,No,,,Goods/Service,Expenditure,"£ 149,999","£ 149,999",£ 0,6,No,No,,ESPO 383_21 Managed Training Services Framework,23/01/2023,22/07/2023,,, conflict management plus  (vendor no: N/A)
7174,Support of Payroll HR System,Directorate of Corporate Services,Information and Communications Technology ,ICT Management,ICT / Software,Yes,No,Yes,Yes,,,Goods/Service,Expenditure,"£ 100,000","£ 100,000",£ 0,12,No,No,,G-Cloud 12,12/01/2023,11/01/2024,,, SumTotal Systems UK Limited (vendor no: 13368)
7109,Euston and Northolt - Electrical Adaptation Works,Directorate of Corporate Services,Property and TSS,Property Major Projects,Construction and FM / Technical Services,No,No,Yes,No,,,Works,Expenditure,"£ 40,000","£ 40,000",£ 0,1,No,No,Delegated Authority,,03/01/2023,02/02/2023,,, Linfield electrical  (vendor no: N/A)
6857,Barnet Fire Station Provision of Motorised Yard Gates,Directorate of Corporate Services,Property and TSS,Property Major Projects,Construction and FM / Industrial Goods,No,No,Yes,No,,,Works,Expenditure,"£ 120,000","£ 120,000",£ 0,3,No,No,Delegated Authority,,02/01/2023,01/04/2023,,, sucurafit  (vendor no: N/A)
6841,Electrical Rewire project at Eltham Fire Station,Directorate of Corporate Services,Property and TSS,Leavers,Construction and FM / Building Operations,No,No,Yes,No,,,Works,Expenditure,"£ 300,000","£ 300,000",£ 0,3,No,No,,,02/01/2023,01/04/2023,,, Lindfield Electrical  (vendor no: N/A)
7058,LED Energy efficient lighting project,Directorate of Corporate Services,Property and TSS,Property Major Projects,Construction and FM / Property Occupation,No,No,Yes,No,,,Works,Expenditure,"£ 55,995","£ 70,000","(£ 14,005)",2,No,No,,,02/01/2023,01/03/2023,,, Millwood Services  (vendor no: N/A)
7135,Park Royal & Forest Hill Windows Renewal,Commissioner,Directorate of Corporate Services,Property Major Projects,Construction and FM / Construction Service Providers,No,No,Yes,No,,,Works,Expenditure,"£ 360,000","£ 360,000",£ 0,16,No,No,,,02/01/2023,01/05/2024,,, Regen construction limited  (vendor no: N/A)
7134,Mobile Paging Application,Directorate of Corporate Services,Information and Communications Technology ,Emergency Services Network,ICT / Communication,No,No,Yes,No,,,Goods/Service,Expenditure,"£ 35,343","£ 36,600","(£ 1,257)",12,No,No,Budget Holder Approval,G-Cloud 12,09/12/2022,08/12/2023,,, PageOne Communications Limited (vendor no: 21138)
6657,Plumstead Fire Station - Refurbishment,Directorate of Corporate Services,Property and TSS,Property Major Projects,Construction and FM / Construction Service Providers,No,Yes,Yes,No,,,Works,Expenditure,"£ 4,500,000","£ 4,500,000",£ 0,12,No,No,Delegated Authority,,03/12/2022,02/12/2023,,, 8 Build  (vendor no: N/A)
7113,Bill Validation and Energy Services,Directorate of Corporate Services,Property and TSS,Property Technical Assurance,Construction and FM / Building Operations,Yes,No,Yes,No,,,Goods/Service,Expenditure,"£ 25,000","£ 25,000",£ 0,24,No,No,Budget Holder Approval,NHS Shared Business Services Framework,01/12/2022,30/11/2024,,, TEAM (vendor no: N/A)
7154,Cisco ISE Licences,Directorate of Corporate Services,Information and Communications Technology ,ICT Management,ICT / Software,Yes,No,Yes,No,,,Goods/Service,Expenditure,"£ 43,150","£ 43,150",£ 0,36,No,No,,,01/12/2022,30/11/2025,,," Computacenter (UK) Ltd (vendor no: N/A), Intuitive Systems & Networks Ltd (ISN) (vendor no: 18395)"
7041,COBRA/PPV acquisition training,Directorate for Preparedness and Response,Operational Resilience and Control,Response and Training,Professional Services  / Development and Training,Yes,No,Yes,No,,,Goods/Service,Expenditure,"£ 99,000","£ 99,000",£ 0,36,No,No,Delegated Authority,,01/12/2022,30/11/2025,,, Northamptonshire County Council (vendor no: N/A)
7008,Company Watch Financial Analytics and Supplier Due Diligence,Directorate of Corporate Services,Procurement and Commercial,Categories & Performance,Professional Services  / Business Support,Yes,No,Yes,No,,,Goods/Service,Expenditure,"£ 67,755","£ 74,478","(£ 6,723)",36,No,No,,,01/12/2022,30/11/2025,,," Company Watch Limited (vendor no: N/A), Company Watch Limited (vendor no: 22457)"
6954,Fire Commander Log Keeper Course (Loggist),"Directorate for Prevention, Protection and Operational Policy",Operational Policy,Incident Command Policy,Professional Services  / Development and Training,Yes,No,Yes,No,,,Goods/Service,Expenditure,"£ 12,000","£ 12,000",£ 0,24,No,No,,,01/12/2022,30/11/2024,,, Bob Clarke (vendor no: N/A)
7090,LexisLibrary,Directorate of Corporate Services,General Counsel,Departmental Management & Business Support,ICT / Software,Yes,No,Yes,No,,,Goods/Service,Expenditure,"£ 28,148","£ 28,148",£ 0,36,No,No,Budget Holder Approval,,01/12/2022,30/11/2025,,, LexisNexis (vendor no: 10367)
6798,Provision of Portable Repeaters,"Directorate for Prevention, Protection and Operational Policy",Operational Policy,Respiratory Protective Equipment Project,ICT / Communication,Yes,No,Yes,No,,,Goods/Service,Expenditure,"£ 149,955","£ 149,955",£ 0,60,No,No,,CCS Network Services 2,01/12/2022,30/11/2027,,, Radiocoms Systems Limited (vendor no: 10961)
6930,Supply of Diesel for Strategic Reserve Storage Tanks ,Directorate for Preparedness and Response,Fire Stations,Fire Stations & Area Team Management,Fleet  / Fuel,Yes,No,Yes,No,,No,Goods/Service,Expenditure,"£ 35,000","£ 450,000","(£ 415,000)",24,No,No,,CCS Fuels ,01/12/2022,30/11/2024,,, WFL UK Limited (vendor no: N/A)
7091,Thomson Reuters - Practical Law and Westlaw,Directorate of Corporate Services,General Counsel,Departmental Management & Business Support,ICT / Software,Yes,No,Yes,No,,,Goods/Service,Expenditure,"£ 56,716","£ 56,716",£ 0,36,No,No,Budget Holder Approval,,01/12/2022,30/11/2025,,, Thomson Reuters (Professional) UK Limited (vendor no: N/A)
6960,LED Energy efficient lighting project,Directorate of Corporate Services,Property and TSS,Property Major Projects,Construction and FM / Energy,No,No,Yes,No,,,Works,Expenditure,"£ 135,141","£ 135,141",£ 0,2,No,No,,,30/11/2022,29/01/2023,,, Lindfield Electrical Services Ltd (vendor no: N/A)
7125,Culture Amp,People Directorate,People Services,Organisational Effectiveness,ICT / Software,Yes,No,Yes,No,,No,Goods/Service,Expenditure,"£ 45,695","£ 45,695",£ 0,12,No,No,Budget Holder Approval,,26/11/2022,25/11/2023,,, Culture Amp (vendor no: N/A)
7127,Portacount Machines,Directorate of Corporate Services,Property and TSS,Operations Support Group,Operational Equipment / Emergency and Rescue Equipment and Supplies,No,No,Yes,No,,,Goods/Service,Expenditure,"£ 54,185","£ 54,185",£ 0,60,No,No,Budget Holder Approval,,22/11/2022,21/11/2027,,, Respiratory Protective Assessment Ltd (vendor no: 18869)
7042,Vehicle Inspection and Fitting of Blues & Twos ,Directorate of Corporate Services,Procurement and Commercial,Vehicle Administration,Fleet  / Vehicle Conversion,Yes,No,Yes,No,,,Goods/Service,Expenditure,"£ 110,000","£ 110,000",£ 0,24,No,No,Budget Holder Approval,,09/11/2022,08/11/2024,,, Pullman Motors (vendor no: N/A)
7117,Advanced Coaching Academy,People Directorate,People Services,Leadership Development,Professional Services  / Learning,No,No,Yes,No,,,Goods/Service,Expenditure,"£ 3,500","£ 3,500",£ 0,12,No,No,Budget Holder Approval,,07/11/2022,06/11/2022,,, Advanced Training Academy  (vendor no: N/A)
7157,Leadership Development for Hos/TMG,People Directorate,People Services,Leadership Development,Professional Services  / Development and Training,No,No,Yes,No,,,Goods/Service,Expenditure,"£ 39,000","£ 39,000",£ 0,13,No,No,,,07/11/2022,06/12/2023,,, The Windsor Leadership Trust (vendor no: 17528)
7022,Dynamic Cover Tool (DCT) - licence and support,Directorate of Corporate Services,Information and Communications Technology ,ICT Management,ICT / Software,Yes,No,Yes,No,,,Goods/Service,Expenditure,"£ 120,000","£ 120,000",£ 0,36,No,No,Budget Holder Approval,,06/11/2022,05/11/2025,,, Operational Research in Health (ORH) (vendor no: 15363)
7021,"Operational research, including modelling services ",Directorate of Corporate Services,Information and Communications Technology ,ICT Management,Professional Services  / Consultancy,No,No,Yes,No,,,Goods/Service,Expenditure,"£ 135,000","£ 135,000",£ 0,36,No,No,Budget Holder Approval,,06/11/2022,05/11/2025,,, Operational Research in Health (ORH) (vendor no: 15363)
7129,Inclusive Leadership Gym - EDI training ,People Directorate,People Services,Inclusion,Professional Services  / Development and Training,Yes,No,Yes,No,,,Goods/Service,Expenditure,"£ 30,400","£ 30,400",£ 0,6,No,No,,,04/11/2022,30/04/2023,,, PAIDEIA TRAINING & CONSULTANCY (vendor no: 22344)
7140,Women in the Fire Service,People Directorate,Training and Professional Development,Training Operations,Professional Services  / Development and Training,No,No,Yes,No,,,Goods/Service,Expenditure,"£ 21,300","£ 21,300",£ 0,12,No,No,,,02/11/2022,01/11/2023,,, Women in the Fire Service  (vendor no: N/A)
6767,Lambeth River Station Refurbishment,Directorate of Corporate Services,Property and TSS,Property Major Projects,Construction and FM / Construction Service Providers,No,No,Yes,No,,,Works,Expenditure,"£ 76,498","£ 3,300,000","(£ 3,223,502)",10,No,No,,,31/10/2022,30/08/2023,,, B Nokes Contracts Ltd (vendor no: 19094)
7130,RSA Remote Access Solution,Directorate of Corporate Services,Information and Communications Technology ,ICT Management,ICT / Software,Yes,No,Yes,No,,,Goods/Service,Expenditure,"£ 13,177","£ 15,000","(£ 1,823)",12,No,No,Budget Holder Approval,,28/10/2022,27/10/2023,,, Computacenter (UK) Ltd (vendor no: N/A)
7019,COBRA/PPV CPD for high threat environments,Directorate for Preparedness and Response,Operational Resilience and Control,Response and Training,Professional Services  / Development and Training,Yes,No,Yes,No,,,Goods/Service,Expenditure,"£ 90,000","£ 45,000","£ 45,000",12,No,No,Head of Procurement approval for single tender action,,25/10/2022,24/10/2023,,, Northamptonshire County Council (vendor no: 20890)
